cluster,title,tfidf
0,4 Pre-season hip/groin strength and ratings of health are associated with prospective injury in professional footballers,0.6941389209874074
0,Injury Surveillance in Major League Soccer: A 4-Year Comparison of Injury on Natural Grass Versus Artificial Turf Field,0.478061061455888
0,Effect of Training and Match Loads on Hamstring Passive Stiffness in Professional Soccer Players.,0.43054233627210803
0,"The Effect of 8-Week Core Training on Balance, Agility and Explosive Force Performance",0.3571377684819109
0,Three-Week Intensive Neuromuscular Training Improves Postural Control in Professional Male Soccer Players,0.3508838764052468
0,Anterior Cruciate Ligament Reconstruction in Young Female Athletes: Patellar Versus Hamstring Tendon Autografts,0.28686850558558946
0,Physical preparation and return to performance of an elite female football player following ACL reconstruction: a journey to the FIFA Women’s World Cup,0.2864595545843279
0,Biomechanical comparison of concussions with and without a loss of consciousness in elite American football: implications for prevention,0.281517941257671
0,Effects of autologous adipose-derived regenerative stem cells administered at the time of anterior cruciate ligament reconstruction on knee function and graft healing,0.2507175449200107
0,A Randomized Controlled Trial of PEEK Versus Titanium Interference Screws for Anterior Cruciate Ligament Reconstruction With 2-Year Follow-up,0.2408965169299601
1,Effects of Post-Activation Potentiation induced by a plyometric protocol on deceleration performance,0.910034615275359
1,"Anterior Cruciate Ligament Research Retreat VIII Summary Statement: An Update on Injury Risk Identification and Prevention Across the Anterior Cruciate Ligament Injury Continuum, March 14–16, 2019, Greensboro, NC",0.6968207530023102
1,"On-field Rehabilitation Part 1: 4 Pillars of High-Quality On-field Rehabilitation Are Restoring Movement Quality, Physical Conditioning, Restoring Sport-Specific Skills, and Progressively Developing Chronic Training Load",0.6593849053681725
1,Maximum acceleration performance of professional soccer players in linear sprints: Is there a direct connection with change-of-direction ability?,0.5485159541924192
1,Protracted Cardiovascular Impairments After Anterior Cruciate Ligament Injury: A Critically Appraised Topic,0.5007487499346219
1,Head and Neck Response of an Active Human Body Model and Finite Element Anthropometric Test Device During a Linear Impactor Helmet Test,0.4964346047746825
1,Effect of Training and Match Loads on Hamstring Passive Stiffness in Professional Soccer Players.,0.4832447664703884
1,One-leg rise performance and associated knee kinematics in ACL-deficient and ACL-reconstructed persons 23 years post-injury,0.446848711979578
1,"Six different football shoes, one playing surface and the weather; Assessing variation in shoe-surface traction over one season of elite football",0.43477002042640567
1,Development of a Concussion Risk Function for a Youth Population Using Head Linear and Rotational Acceleration,0.42178220984199677
2,"Lower-Limb Muscle Excitation, Peak Torque, and External Load Responses to a 120-Minute Treadmill-Based Soccer-Specific Simulation",0.937812023863511
2,Pre-Season Bilateral Strength Asymmetries of Professional Soccer Players and Relationship with Non-Contact Injury of Lower Limb in the Season,0.875645722048391
2,Relative Motion Between the Helmet and the Head in Football Impact Test,0.8230539794679108
2,Impact Mechanics of Football Helmet with Various Shell Liner Configurations,0.8019937975407155
2,Aerobic and anaerobic physical capacities per station based on field tests of elite Melano-African footballers in hot and humid environments,0.7715193642766645
2,Asymmetry between the dominant and non-dominant legs in the lower limb biomechanics during single-leg landings in females,0.7687686246603109
2,"Place, Ecological Dynamics and Football",0.7626849634328929
2,Biomechanical asymmetries persist after ACL reconstruction: results of a 2-year study,0.7400142348907143
2,Comparison of the Angular Compartment of Hip Flexion Before and After Training in 11 to 12-Year-old Soccer Players.,0.7319492703112247
2,Sprint and jump performances in highly trained young soccer players of different chronological age: Effects of linear VS. CHANGE–OF–DIRECTION sprint training,0.684001312137487
3,"The Increased Effectiveness of Loaded Versus Unloaded Plyometric Jump Training in Improving Muscle Power, Speed, Change of Direction, and Kicking-Distance Performance in Prepubertal Male Soccer Players",0.7388075866396286
3,Analysis of some biomechanical variables influencing the accuracy of direct free kicks in soccer,0.6891778820907499
3,Biomechanical Comparison of Cutting Techniques: A Review and Practical Applications,0.6685334166639297
3,"The Physiological, Physical, and Biomechanical Demands of Walking Football: Implications for Exercise Prescription and Future Research in Older Adults",0.6564912250902175
3,Neuromuscular Control of Vertical Jumps in Female Adolescents,0.6178073784386752
3,Statistical Parametric Mapping을 이용한 시상면에서의 양발 착지와 외발 착지의 전략 차이,0.6035163574564987
3,Kinematic analysis of soccer goalkeepers’ diving motion towards shots placed far away,0.5942313671638272
3,Compression Garments Reduce Muscle Movement and Activation during Submaximal Running,0.5548382188233176
3,The Effects of Six-Weeks Change of Direction Speed and Technique Modification Training on Cutting Performance and Movement Quality in Male Youth Soccer Players,0.5525080405025073
3,No Evidence of Association Between Soccer Heading and Cognitive Performance in Professional Soccer Players: Cross-Sectional Results,0.5382459947099097
4,Concussion prevention strategies: A Survey of division I and division II female soccer teams,0.7802131443915763
4,"Determinants of concussion diagnosis, symptomology, and resolution time in U.S. high school soccer players",0.7125737005696787
4,Accounting for Variance in Concussion Tolerance Between Individuals: Comparing Head Accelerations Between Concussed and Physically Matched Control Subjects,0.5305973763694845
4,"Peer Review #2 of ""Changes in sprint performance and sagittal plane kinematics after heavy resisted sprint training in professional soccer players (v0.1)""",0.49633774101973255
4,Observational Study of Prevention and Intervention Strategies That Help Speed Return to Play Post-Concussion in Division I College Football,0.48766545269057826
4,Soccer Scoring Techniques — a Scientific Re-conception of Time and Space via Biomechanical Modeling,0.47750349991009733
4,Estimated age of first exposure to American football and outcome from concussion,0.47723195722594697
4,"Peer Review #1 of ""Changes in sprint performance and sagittal plane kinematics after heavy resisted sprint training in professional soccer players (v0.1)""",0.4573813122243964
4,The Relationship between Nordic Hamstring Test and Isokinetic Dynamometry in Football and Track and Field Student Athletes: a Cross-Sectional Study,0.45276039574577903
4,Concussion related deficits in the general population predict impairments in varsity footballers,0.45173268900270513
5,Differences in Anthropometric Characteristics among Junior Soccer and Volleyball Players,2.143414825353623
5,Analysis of Foot Morphology in Habitually Barefoot Group,1.6891905756302488
5,Double Acl Reconstruction Failure in A Young Soccer Player In Treatment with Retinoids: A Case Report,1.666668337138073
5,Is Foot Type an Indicator of Anterior Cruciate Ligament Injury in Football Players?,1.663079217045864
5,Footwear and injury prevention in elite American football,1.6020934868492662
5,Running patterns and force‐velocity sprinting profiles in elite training young soccer players: A cross‐sectional study,1.6010725354977349
5,A common neural signature of brain injury in concussion and subconcussion,1.5849822096331825
5,Using Virtual Environments to Improve Real-World Motor Skills in Sports: A Systematic Review,1.5805718557349961
5,Balance and Core Stabilization Training with Eyes Open Versus Eyes Closed in Young Football Players,1.5657627234434766
5,Cleat stiffness influences ankle inversion in football players with history of ankle sprain,1.5123759602013247
6,Relative Motion Between the Helmet and the Head in Football Impact Test,0.7085344553207611
6,Biomechanical Analysis of Head Impacts during Real Time Soccer Play: a Preliminary Study,0.582505311533426
6,Soccer-related head injuries—analysis of sentinel surveillance data collected by the electronic Canadian Hospitals Injury Reporting and Prevention Program,0.5304874993276492
6,Head and Neck Response of an Active Human Body Model and Finite Element Anthropometric Test Device During a Linear Impactor Helmet Test,0.5159189256617853
6,BIOMECHANIC DATA-DRIVEN BEHAVIOR MODIFICATION TO REDUCE CONCUSSION RISK IN HIGH SCHOOL FOOTBALL ATHLETES,0.381514327386578
6,Repetitive Head Impact Exposure in College Football Following an NCAA Rule Change to Eliminate Two-A-Day Preseason Practices: A Study from the NCAA-DoD CARE Consortium,0.2901151054445354
6,Passive cervical spine ligaments provide stability during head impacts,0.24833354957999385
6,Development and Multi-Scale Validation of a Finite Element Football Helmet Model,0.23229506938803773
6,Physical Performance Measures Correlate with Head Impact Exposure in Youth Football,0.21014599107531406
6,COMPARISON OF HEAD IMPACT BIOMECHANICS BETWEEN TACKLE AND FLAG YOUTH FOOTBALL,0.1982929090134619
7,Repetitive Head Impact Exposure in College Football Following an NCAA Rule Change to Eliminate Two-A-Day Preseason Practices: A Study from the NCAA-DoD CARE Consortium,0.8356340424526941
7,BIOMECHANICAL MEASURES DURING TWO SPORT-SPECIFIC TASKS DIFFERENTIATE BETWEEN SOCCER PLAYERS WHO GO ON TO ANTERIOR CRUCIATE LIGAMENT INJURY AND THOSE WHO DO NOT: A PROSPECTIVE COHORT ANALYSIS,0.4311665523907152
7,Body sensor networks for monitoring performances in sports: A brief overview and some new thoughts,0.4014439565908461
7,Physical Performance Measures Correlate with Head Impact Exposure in Youth Football,0.38311694398428703
7,Comparison of selected lower limb biomechanical variables between university of ibadan sportsmen with and without patellofemoral pain syndrome,0.333100835359575
7,A review on aerodynamics and hydrodynamics in sports,0.3295199552034508
7,Passive cervical spine ligaments provide stability during head impacts,0.3206697209586021
7,Biomechanics of accurate and inaccurate goal-kicking in Australian football: Group-based analysis,0.30855219745287904
7,Lower Extremity Biomechanics Are Altered Across Maturation in Sport-Specialized Female Adolescent Athletes,0.29796517326119937
7,Evaluation of skin-mounted sensor for head impact measurement,0.26164358107915514
